{
  "os": "Windows-11-10.0.26200-SP0",
  "cpu": "AMD64 Family 26 Model 68 Stepping 0, AuthenticAMD",
  "ram_gb": 31.14,
  "gpu_and_driver": "Unknown (Implement nvidia-smi parsing if needed)",
  "compiler": "Unknown",
  "storage_device": "Unknown",
  "git_commit": "Unknown",
  "build_flags": "O3",
  "model_hash": "dummy_hash",
  "quantization": "int4",
  "context_size": 2048,
  "cache_state": "cold",
  "backend": "native",
  "env_vars": {
    "OMP_NUM_THREADS": "8"
  },
  "prompt_hash": "dummy_prompt",
  "generated_tokens": 100,
  "warmup_runs": 1,
  "measured_repetitions": 5,
  "median_tok_s": 45.5,
  "p90_tok_s": 46.36,
  "p95_tok_s": 46.48000000000001,
  "stddev_tok_s": 0.5449770637375494,
  "peak_rss_mb": 1024.0,
  "gates_passed": {
    "token_parity": true,
    "no_kv_corruption": true,
    "no_memory_leak": true,
    "no_deadlock": true,
    "no_stream_mismatch": true,
    "no_fd_thread_leak": true
  }
}